{
  "description": "Subscribed admin calls a REST endpoint and receives the upstream JSON response.",
  "expected": {
    "decisions": {
      "auth": "authenticated",
      "protocol": "rest",
      "retry_count": 0,
      "route_source": "endpoint",
      "selected_upstream": "http://upstream.test/hello"
    },
    "response": {
      "body": {
        "body": null,
        "headers": {
          "x-request-id": "<request-id>"
        },
        "method": "GET",
        "ok": true,
        "params": {},
        "url": "http://upstream.test/hello"
      },
      "content_type": "application/json",
      "headers": {
        "content-type": "application/json",
        "request_id": "<request-id>",
        "x-request-id": "<request-id>"
      },
      "status": 200
    },
    "state_changes": {},
    "upstream_requests": [
      {
        "body": null,
        "headers": {
          "x-request-id": "<request-id>"
        },
        "method": "GET",
        "params": {},
        "url": "http://upstream.test/hello"
      }
    ]
  },
  "name": "rest_happy_path",
  "request": {
    "body": null,
    "headers": {},
    "method": "GET",
    "path": "/api/rest/parityhappy/v1/hello",
    "query": {}
  },
  "schema_version": 1,
  "setup": {
    "api": {
      "name": "parityhappy",
      "servers": [
        "http://upstream.test"
      ],
      "version": "v1"
    },
    "endpoint": {
      "method": "GET",
      "servers": [
        "http://upstream.test"
      ],
      "uri": "/hello"
    },
    "subscription": {
      "username": "admin"
    }
  },
  "tags": [
    "rest",
    "auth",
    "upstream"
  ]
}
