{
  "description": "Public health probe returns the Python gateway online status.",
  "expected": {
    "decisions": {
      "auth": "not_required",
      "route": "gateway.health",
      "upstream": "none"
    },
    "response": {
      "body": {
        "status": "online"
      },
      "content_type": "application/json",
      "headers": {
        "content-encoding": "gzip",
        "content-type": "application/json",
        "request_id": "<request-id>",
        "vary": "accept-encoding",
        "x-request-id": "<request-id>"
      },
      "status": 200
    },
    "state_changes": {},
    "upstream_requests": []
  },
  "name": "health_public",
  "request": {
    "body": null,
    "headers": {
      "accept-encoding": "gzip"
    },
    "method": "GET",
    "path": "/api/health",
    "query": {}
  },
  "schema_version": 1,
  "setup": {
    "auth": "none",
    "state": "default memory test app"
  },
  "tags": [
    "read-only",
    "public",
    "health"
  ]
}
