{
  "description": "Gateway status endpoint rejects unauthenticated callers.",
  "expected": {
    "decisions": {
      "auth": "missing",
      "route": "gateway.status",
      "upstream": "none"
    },
    "response": {
      "body": {
        "error_code": "GTW401",
        "error_message": "Unauthorized"
      },
      "content_type": "application/json",
      "headers": {
        "content-type": "application/json",
        "request_id": "<request-id>",
        "x-request-id": "<request-id>"
      },
      "status": 401
    },
    "state_changes": {},
    "upstream_requests": []
  },
  "name": "status_unauthorized",
  "request": {
    "body": null,
    "headers": {},
    "method": "GET",
    "path": "/api/status",
    "query": {}
  },
  "schema_version": 1,
  "setup": {
    "auth": "none",
    "state": "default memory test app"
  },
  "tags": [
    "read-only",
    "auth",
    "error"
  ]
}
