{
  "description": "Configured API with no matching endpoint returns the Python missing-endpoint error.",
  "expected": {
    "decisions": {
      "error_code": "GTW003",
      "route_source": "none",
      "upstream": "not_called"
    },
    "response": {
      "body": {
        "error_code": "GTW003",
        "error_message": "Endpoint does not exist for the requested API"
      },
      "content_type": "application/json",
      "headers": {
        "content-type": "application/json",
        "request_id": "<request-id>",
        "x-request-id": "<request-id>"
      },
      "status": 404
    },
    "state_changes": {},
    "upstream_requests": []
  },
  "name": "rest_not_found",
  "request": {
    "body": null,
    "headers": {},
    "method": "GET",
    "path": "/api/rest/paritymissing/v1/missing",
    "query": {}
  },
  "schema_version": 1,
  "setup": {
    "api": {
      "name": "paritymissing",
      "version": "v1"
    },
    "endpoint": {
      "method": "GET",
      "servers": [
        "http://upstream.test"
      ],
      "uri": "/exists"
    },
    "subscription": {
      "username": "admin"
    }
  },
  "tags": [
    "rest",
    "routing",
    "error"
  ]
}
